{
  "_COMO_USAR": "Exemplo de perfil. Copie para bot/perfil.json e ajuste niveis/area/termos/pular_tipos ao SEU caso. Este arquivo de exemplo NUNCA vai ao git com dados reais.",
  "nome_perfil": "estagio-qa-exemplo",
  "niveis": [
    "estagio",
    "trainee"
  ],
  "area": "tecnologia (QA / testes de software)",
  "termos": [
    "estagio qa remoto",
    "estagio testes de software",
    "estagio qualidade de software remoto",
    "trainee qa remoto"
  ],
  "pular_tipos": [
    "ciência de dados",
    "BI",
    "design/UX",
    "ERP/funcional",
    "exclusiva PCD"
  ]
}
