{
  "_COMO_USAR": "Exemplo de perfil. Copie para bot/perfil.json e ajuste niveis/area/termos/pular_tipos ao SEU caso. Este arquivo de exemplo NUNCA vai ao git com dados reais.",
  "nome_perfil": "junior-backend-exemplo",
  "niveis": [
    "trainee",
    "junior"
  ],
  "area": "tecnologia (desenvolvimento backend)",
  "termos": [
    "desenvolvedor backend junior",
    "backend junior remoto",
    "desenvolvedor fullstack junior",
    "trainee desenvolvedor remoto"
  ],
  "pular_tipos": [
    "ciência de dados",
    "BI",
    "design/UX",
    "ERP/funcional",
    "exclusiva PCD"
  ]
}
